{
  "export_format_version": "1.0",
  "overlay_schema_version": "1.0",
  "organization_id": "unconfigured-org",
  "created_at": "2026-09-03T00:00:00Z",
  "overlay_manifest_hash": "sha256:0000000000000000000000000000000000000000000000000000000000000000",
  "inventory_hash_algorithm": "sha256-path-null-sha256-newline-v1",
  "inventory_hash": "sha256:2dfc7343d684b31645f83dc9d016058bcb24e9da548ff1056c360c0766f6c27a",
  "files": [
    {
      "path": "overlay.json",
      "sha256": "sha256:0000000000000000000000000000000000000000000000000000000000000000",
      "bytes": 0,
      "category": "manifest"
    },
    {
      "path": "state/registry.json",
      "sha256": "sha256:1111111111111111111111111111111111111111111111111111111111111111",
      "bytes": 0,
      "category": "state"
    }
  ],
  "excluded_content": [
    "campaign-workspaces",
    "credentials",
    "production-row-data",
    "blind-materials"
  ],
  "restore_policy": {
    "on_incompatible_version": "leave-unchanged",
    "on_hash_mismatch": "abort-without-write",
    "overwrite_existing": false
  }
}
